Datetime,Scramble,TotalTime,PlanMistake,MemoMistake,DoMistake,PlanTime,MemoTime,MemoRecallTime,DoTime,MemoEndTime,EdgesLetters,CornersLetters,Comment
2025-08-07 20:04:11.182449,F L2 U2 F2 D2 B L2 B' R2 F' D2 U2 L R D L' F D' F' D' F2,715.153,1,1,0,204.092,89.245,230.307,191.509,,SL QT VX JF UC RK,OL FH KC BJ,
2025-08-07 20:17:58.773114,U B' R U2 R2 D' B2 L2 U' L2 R2 U F2 D2 R' F D2 B L2 R' B',684.542,0,1,0,172.198,164.459,169.902,177.983,,EF JA XU NG VI SH O,VD BJ LH P,
2025-08-07 22:00:25.928351,L U R L' F' R' U2 L F L F2 D2 B2 U2 D2 R F2 L2 D2 R' B2,567.09,1,0,0,255.217,65.37,90.848,155.655,78.006,XD LT KS JC OR DA Q,UC QV IT P,
2025-08-08 10:23:27.040881,L2 F' D2 R' L' U' B' F2 U2 R L U2 D2 L D2 B2 R' F2 D2 U B',808.354,1,1,0,287.286,121.353,174.746,224.969,48.368,EC NL RS PO XK XA Q,JQ IS OG V,
2025-08-08 10:49:20.672894,B' D2 L F2 B R' D' B' U B2 L2 U F2 R2 U L2 F2 U F2 D',748.764,1,1,0,175.355,184.53,229.611,159.268,84.496,KX CO WD HL JF NA N,IU HM VQ KW O,
